{
  "chapter": 19,
  "title": "Chapter 19",
  "source": {
    "pdf_pages": [
      219,
      225
    ],
    "source_sha256": "297b92bc48e075449713c3b408ccf47de2466cfc6c4f4a25687a2a974276ae4d",
    "answer_key_pdf_pages": [
      515
    ]
  },
  "topics": [
    {
      "id": "ch19-t01",
      "title": "Formation of the imperative",
      "exercise_ids": [
        "ch19-ex01"
      ]
    },
    {
      "id": "ch19-t02",
      "title": "Irregular imperative forms",
      "exercise_ids": []
    },
    {
      "id": "ch19-t03",
      "title": "The imperative of pronominal verbs",
      "exercise_ids": [
        "ch19-ex02",
        "ch19-ex03"
      ]
    }
  ],
  "exercise_ids": [
    "ch19-ex01",
    "ch19-ex02",
    "ch19-ex03"
  ],
  "question_total": 30,
  "validation": {
    "source_pages": 7,
    "source_chars": 9037,
    "source_partition_complete": true,
    "exercise_group_markers_detected": 3,
    "questions_structured": 30,
    "answer_key_entries_associated": 30,
    "editorial_visual_review": "pending_glyph_by_glyph_check",
    "theory_semantic_format": "partially_indexed_source_text_preserved",
    "theory_source_segments": 2,
    "text_semantic_format": "source-aligned_markdown_fenced_text_pending_table_visual_proof",
    "answer_key_count": 30
  },
  "subtopics": [
    {
      "id": "ch19-s01",
      "title": "Formation of the imperative",
      "parent_topic_id": "ch19-t01",
      "pdf_pages": [
        219,
        219
      ],
      "exercise_ids": [
        "ch19-ex01"
      ],
      "kind": "grammar"
    },
    {
      "id": "ch19-s02",
      "title": "Irregular imperative forms",
      "parent_topic_id": "ch19-t02",
      "pdf_pages": [
        222,
        222
      ],
      "exercise_ids": [],
      "kind": "grammar"
    },
    {
      "id": "ch19-s03",
      "title": "The imperative of pronominal verbs",
      "parent_topic_id": "ch19-t03",
      "pdf_pages": [
        223,
        223
      ],
      "exercise_ids": [
        "ch19-ex02",
        "ch19-ex03"
      ],
      "kind": "grammar"
    }
  ]
}
