{
  "chapter": 28,
  "title": "Chapter 28",
  "source": {
    "pdf_pages": [
      353,
      385
    ],
    "source_sha256": "297b92bc48e075449713c3b408ccf47de2466cfc6c4f4a25687a2a974276ae4d",
    "answer_key_pdf_pages": [
      523,
      524,
      525,
      526,
      527
    ]
  },
  "topics": [
    {
      "id": "ch28-t01",
      "title": "Cumulative review exercises",
      "exercise_ids": [
        "ch28-ex01",
        "ch28-ex02",
        "ch28-ex03",
        "ch28-ex04",
        "ch28-ex05",
        "ch28-ex06",
        "ch28-ex07",
        "ch28-ex08",
        "ch28-ex09",
        "ch28-ex10",
        "ch28-ex11",
        "ch28-ex12",
        "ch28-ex13",
        "ch28-ex14",
        "ch28-ex15",
        "ch28-ex16",
        "ch28-ex17",
        "ch28-ex18",
        "ch28-ex19",
        "ch28-ex20",
        "ch28-ex21",
        "ch28-ex22",
        "ch28-ex23",
        "ch28-ex24",
        "ch28-ex25",
        "ch28-ex26",
        "ch28-ex27",
        "ch28-ex28",
        "ch28-ex29",
        "ch28-ex30",
        "ch28-ex31",
        "ch28-ex32",
        "ch28-ex33",
        "ch28-ex34",
        "ch28-ex35"
      ]
    }
  ],
  "exercise_ids": [
    "ch28-ex01",
    "ch28-ex02",
    "ch28-ex03",
    "ch28-ex04",
    "ch28-ex05",
    "ch28-ex06",
    "ch28-ex07",
    "ch28-ex08",
    "ch28-ex09",
    "ch28-ex10",
    "ch28-ex11",
    "ch28-ex12",
    "ch28-ex13",
    "ch28-ex14",
    "ch28-ex15",
    "ch28-ex16",
    "ch28-ex17",
    "ch28-ex18",
    "ch28-ex19",
    "ch28-ex20",
    "ch28-ex21",
    "ch28-ex22",
    "ch28-ex23",
    "ch28-ex24",
    "ch28-ex25",
    "ch28-ex26",
    "ch28-ex27",
    "ch28-ex28",
    "ch28-ex29",
    "ch28-ex30",
    "ch28-ex31",
    "ch28-ex32",
    "ch28-ex33",
    "ch28-ex34",
    "ch28-ex35"
  ],
  "question_total": 345,
  "validation": {
    "source_pages": 33,
    "source_chars": 40387,
    "source_partition_complete": true,
    "exercise_group_markers_detected": 35,
    "questions_structured": 345,
    "answer_key_entries_associated": 345,
    "editorial_visual_review": "pending_glyph_by_glyph_check",
    "theory_semantic_format": "partially_indexed_source_text_preserved",
    "theory_source_segments": 1,
    "text_semantic_format": "source-aligned_markdown_fenced_text_pending_table_visual_proof",
    "answer_key_count": 345
  },
  "subtopics": [
    {
      "id": "ch28-s01",
      "title": "Cumulative review exercises",
      "parent_topic_id": "ch28-t01",
      "pdf_pages": [
        353,
        353
      ],
      "exercise_ids": [
        "ch28-ex01",
        "ch28-ex02",
        "ch28-ex03",
        "ch28-ex04",
        "ch28-ex05",
        "ch28-ex06",
        "ch28-ex07",
        "ch28-ex08",
        "ch28-ex09",
        "ch28-ex10",
        "ch28-ex11",
        "ch28-ex12",
        "ch28-ex13",
        "ch28-ex14",
        "ch28-ex15",
        "ch28-ex16",
        "ch28-ex17",
        "ch28-ex18",
        "ch28-ex19",
        "ch28-ex20",
        "ch28-ex21",
        "ch28-ex22",
        "ch28-ex23",
        "ch28-ex24",
        "ch28-ex25",
        "ch28-ex26",
        "ch28-ex27",
        "ch28-ex28",
        "ch28-ex29",
        "ch28-ex30",
        "ch28-ex31",
        "ch28-ex32",
        "ch28-ex33",
        "ch28-ex34",
        "ch28-ex35"
      ],
      "kind": "grammar"
    }
  ]
}
